### ISSUE TITLE
Keep alive outside

### ISSUE THREAD

**Issue by WuvorWenda** [aitschti/scp-standalone#7]
Proxy is sending tcp resets to DOPP how to keep the outgoing connection alive?
internal is now oke.
IP6 XXXXXXXXXXXXXXXXXXXXXXXXXXXXXXXXXXa1.46104 > zzzzzzzzzzzzzzzzzz72.443: Flags [R], seq 
IP6 XXXXXXXXXXXXXXXXXXXXXXXXXXXXXXXXXXa1.46130 > zzzzzzzzzzzzzzzzzz72.443: Flags [R], seq 
IP6 XXXXXXXXXXXXXXXXXXXXXXXXXXXXXXXXXXa1.46194 > zzzzzzzzzzzzzzzzzz72.443: Flags [R], seq 
IP6 XXXXXXXXXXXXXXXXXXXXXXXXXXXXXXXXXXa1.46276 > zzzzzzzzzzzzzzzzzz72.443: Flags [R], seq
IP6 XXXXXXXXXXXXXXXXXXXXXXXXXXXXXXXXXXa1.46278 > zzzzzzzzzzzzzzzzzz72.443: Flags [R], seq 
IP6 XXXXXXXXXXXXXXXXXXXXXXXXXXXXXXXXXXa1.46278 > zzzzzzzzzzzzzzzzzz72.443: Flags [R], seq 
IP6 XXXXXXXXXXXXXXXXXXXXXXXXXXXXXXXXXXa1.46278 > zzzzzzzzzzzzzzzzzz72.443: Flags [R], seq 

My goal to mimic browers behavior. to keep a low profile.... ;)
I have tried to put conection keep-alive in the outgoing headers.
But the proxy keep sending TCP reset requests.

for example streamlink on other site do not change port number.
Just tested with the browser on http proxy all port numbers stay the same.

I think the "low profile is very important"
Can be something changed in urllib? (preventing reset sending)
Thanks.
